{
  "children": [],
  "kind": "INDEX",
  "leaves": ["remediation/schema/actor.schema.json", "remediation/schema/baseline.schema.json", "remediation/schema/context-contracts.schema.json", "remediation/schema/context-core.schema.json", "remediation/schema/context.schema.json", "remediation/schema/control-change.schema.json", "remediation/schema/delivery-control.schema.json", "remediation/schema/delivery-product.schema.json", "remediation/schema/delivery-target.schema.json", "remediation/schema/id-set.schema.json", "remediation/schema/id.schema.json", "remediation/schema/index-pointer.schema.json", "remediation/schema/manifest-index.schema.json", "remediation/schema/node-design.schema.json", "remediation/schema/node-group-a.schema.json", "remediation/schema/node-group-b.schema.json", "remediation/schema/node-implementation.schema.json", "remediation/schema/node-readiness.schema.json", "remediation/schema/node-release-convergence.schema.json", "remediation/schema/node-release-step.schema.json", "remediation/schema/node-review.schema.json", "remediation/schema/node-staged-candidate.schema.json", "remediation/schema/node-verification.schema.json", "remediation/schema/node.schema.json", "remediation/schema/payload-design.schema.json", "remediation/schema/payload-implementation.schema.json", "remediation/schema/payload-readiness.schema.json", "remediation/schema/payload-release-convergence.schema.json", "remediation/schema/payload-release-step.schema.json", "remediation/schema/payload-review.schema.json", "remediation/schema/payload-staged-candidate.schema.json", "remediation/schema/payload-verification.schema.json", "remediation/schema/plan-root-a.schema.json", "remediation/schema/plan-root-b.schema.json", "remediation/schema/requirement-candidate.schema.json", "remediation/schema/requirement-implementation.schema.json", "remediation/schema/requirement-release-step.schema.json", "remediation/schema/requirement-release-surface.schema.json", "remediation/schema/requirement-release.schema.json", "remediation/schema/root.schema.json", "remediation/schema/safe-path.schema.json", "remediation/schema/scenario.schema.json", "remediation/schema/sha1-oid.schema.json", "remediation/schema/string-sequence.schema.json", "remediation/schema/string-set.schema.json", "remediation/schema/verification-requirement-a.schema.json", "remediation/schema/verification-requirement-b.schema.json", "remediation/schema/verification-requirement.schema.json", "remediation/schema/work-unit.schema.json"],
  "prefix": "",
  "recordCount": 49,
  "schema": "urn:fingrind:ledger1:manifest-index"
}
